{
  "protocolVersion": "0.0.2",
  "bundleType": "document",
  "createdAt": "2026-03-07T20:30:00Z",
  "registry": {
    "uri": "https://registry.cliproot.org",
    "bundleId": "bundle_doc_01"
  },
  "document": {
    "id": "doc_01",
    "uri": "https://example.com/docs/doc_01",
    "title": "Sample Attributed Document",
    "canonicalHash": "sha256-AAAAAAAAAAAAAAAAAAAAAAAAAAAAAAAAAAAAAAAAAAA"
  },
  "agents": [
    {
      "id": "agent_alice",
      "agentType": "person",
      "name": "Alice"
    }
  ],
  "sources": [
    {
      "id": "src_01",
      "sourceType": "human-authored",
      "title": "Original Draft",
      "sourceUri": "https://example.com/source/original",
      "authorAgentId": "agent_alice",
      "createdAt": "2026-03-07T20:00:00Z"
    }
  ],
  "clips": [
    {
      "clipHash": "sha256-BBBBBBBBBBBBBBBBBBBBBBBBBBBBBBBBBBBBBBBBBBB",
      "id": "clip_01",
      "documentId": "doc_01",
      "sourceRefs": ["src_01"],
      "selectors": {
        "textPosition": {
          "start": 0,
          "end": 23
        },
        "textQuote": {
          "exact": "Provenance starts here."
        },
        "editorPath": "0/0/0",
        "dom": {
          "elementId": "paragraph-1",
          "classPath": "article-body p.lede"
        }
      },
      "content": "Provenance starts here.",
      "textHash": "sha256-CCCCCCCCCCCCCCCCCCCCCCCCCCCCCCCCCCCCCCCCCCC",
      "createdByActivityId": "act_01"
    },
    {
      "clipHash": "sha256-DDDDDDDDDDDDDDDDDDDDDDDDDDDDDDDDDDDDDDDDDDD",
      "id": "clip_02",
      "documentId": "doc_01",
      "sourceRefs": ["src_01"],
      "selectors": {
        "textQuote": {
          "exact": "Provenance starts here, and this clip derives from clip_01.",
          "prefix": "Introduction: ",
          "suffix": " End."
        }
      },
      "content": "Provenance starts here, and this clip derives from clip_01.",
      "textHash": "sha256-EEEEEEEEEEEEEEEEEEEEEEEEEEEEEEEEEEEEEEEEEEE",
      "createdByActivityId": "act_02"
    }
  ],
  "derivationEdges": [
    {
      "id": "edge_01",
      "childClipHash": "sha256-DDDDDDDDDDDDDDDDDDDDDDDDDDDDDDDDDDDDDDDDDDD",
      "parentClipHash": "sha256-BBBBBBBBBBBBBBBBBBBBBBBBBBBBBBBBBBBBBBBBBBB",
      "transformationType": "edit",
      "createdAt": "2026-03-07T20:05:00Z"
    }
  ],
  "activities": [
    {
      "id": "act_01",
      "activityType": "create",
      "agentId": "agent_alice",
      "usedSourceRefs": ["src_01"],
      "generatedClipRefs": ["clip_01"],
      "createdAt": "2026-03-07T20:01:00Z"
    },
    {
      "id": "act_02",
      "activityType": "edit",
      "agentId": "agent_alice",
      "usedSourceRefs": ["src_01"],
      "generatedClipRefs": ["clip_02"],
      "createdAt": "2026-03-07T20:05:00Z"
    }
  ],
  "reuseEvents": [],
  "signatures": []
}
